awardnumber,startfiscalyear,endfiscalyear,directcost,allocation_niicode,institution_niicode,project_length,field_niicode,institution_table_group,doi,Title,Authors,Source Title,Publication Date,Publication Year,Conference Title,Conference Date,Total Citations,Average per Year,ave3,ave5
23370019,2011,2013,12600000,0,13901,3,BIO,1,10.1093/pcp/pcr072,Immunohistochemical Detection of Blue Light-Induced Phosphorylation of the Plasma Membrane H+-ATPase in Stomatal Guard Cells,"Hayashi, Maki; Inoue, Shin-ichiro; Takahashi, Koji; Kinoshita, Toshinori",PLANT AND CELL PHYSIOLOGY,JUL 2011,2011,,,95.0,7.31,4.333333333,6.4
23370019,2011,2013,12600000,0,13901,3,BIO,1,10.1007/s10265-011-0426-x,"Mg-chelatase H subunit affects ABA signaling in stomatal guard cells, but is not an ABA receptor in Arabidopsis thaliana","Tsuzuki, Tomo; Takahashi, Koji; Inoue, Shin-ichiro; Okigaki, Yukiko; Tomiyama, Masakazu; Hossain, Mohammad Anowar; Shimazaki, Ken-ichiro; Murata, Yoshiyuki; Kinoshita, Toshinori",JOURNAL OF PLANT RESEARCH,JUL 2011,2011,,,54.0,4.15,6.0,6.4
23370019,2011,2013,12600000,0,13901,3,BIO,1,10.3389/fpls.2013.00440,Overexpression of the Mg-chelatase H subunit in guard cells confers drought tolerance via promotion of stomatal closure in Arabidopsis thaliana,"Tsuzuki, Tomo; Takahashi, Koji; Tomiyama, Masakazu; Inoue, Shin-ichiro; Kinoshita, Toshinori",FRONTIERS IN PLANT SCIENCE,OCT 30 2013,2013,,,18.0,1.64,3.333333333,2.6
23370019,2011,2013,12600000,0,13901,3,BIO,1,10.1093/pcp/pcu028,Abscisic Acid Suppresses Hypocotyl Elongation by Dephosphorylating Plasma Membrane H+-ATPase in Arabidopsis thaliana,"Hayashi, Yuki; Takahashi, Koji; Inoue, Shin-ichiro; Kinoshita, Toshinori",PLANT AND CELL PHYSIOLOGY,APR 2014,2014,,,63.0,6.3,4.666666667,6.4
23370019,2011,2013,12600000,0,13901,3,BIO,1,10.1007/s11104-012-1136-4,Stimulation of phosphorus uptake by ammonium nutrition involves plasma membrane H+ ATPase in rice roots,"Zeng, Houqing; Liu, Gan; Kinoshita, Toshinori; Zhang, Ruiping; Zhu, Yiyong; Shen, Qirong; Xu, Guohua",PLANT AND SOIL,AUG 2012,2012,,,45.0,3.75,0.333333333,2.4
23370019,2011,2013,12600000,0,13901,3,BIO,1,10.1104/pp.111.175943,Functional Analyses of the Activation Loop of Phototropin2 in Arabidopsis,"Inoue, Shin-ichiro; Matsushita, Tomonao; Tomokiyo, Yuta; Matsumoto, Masaki; Nakayama, Keiichi I.; Kinoshita, Toshinori; Shimazaki, Ken-ichiro",PLANT PHYSIOLOGY,MAY 2011,2011,,,58.0,4.46,5.0,5.6
23390232,2011,2013,14800000,0,14301,3,BIO,1,10.1016/j.stem.2013.01.009,Modeling Alzheimer's Disease with iPSCs Reveals Stress Phenotypes Associated with Intracellular A beta and Differential Drug Responsiveness,"Kondo, Takayuki; Asai, Masashi; Tsukita, Kayoko; Kutoku, Yumiko; Ohsawa, Yutaka; Sunada, Yoshihide; Imamura, Keiko; Egawa, Naohiro; Yahata, Naoki; Okita, Keisuke; Takahashi, Kazutoshi; Asaka, Isao; Aoi, Takashi; Watanabe, Akira; Watanabe, Kaori; Kadoya, Chie; Nakano, Rie; Watanabe, Dai; Maruyama, Kei; Hori, Osamu; Hibino, Satoshi; Choshi, Tominari; Nakahata, Tatsutoshi; Hioki, Hiroyuki; Kaneko, Takeshi; Naitoh, Motoko; Yoshikawa, Katsuhiro; Yamawaki, Satoko; Suzuki, Shigehiko; Hata, Ryuji; Ueno, Shu-ichi; Seki, Tsuneyoshi; Kobayashi, Kazuhiro; Toda, Tatsushi; Murakami, Kazuma; Irie, Kazuhiro; Klein, William L.; Mori, Hiroshi; Asada, Takashi; Takahashi, Ryosuke; Iwata, Nobuhisa; Yamanaka, Shinya; Inoue, Haruhisa",CELL STEM CELL,APR 4 2013,2013,,,512.0,46.55,41.66666667,50.8
23390232,2011,2013,14800000,0,14301,3,BIO,1,10.1016/j.febslet.2013.02.046,"ATP13A2 deficiency induces a decrease in cathepsin D activity, fingerprint-like inclusion body formation, and selective degeneration of dopaminergic neurons","Matsui, Hideaki; Sato, Fumiaki; Sato, Shigeto; Koike, Masato; Taruno, Yosuke; Saiki, Shinji; Funayama, Manabu; Ito, Hidefumi; Taniguchi, Yoshihito; Uemura, Norihito; Toyoda, Atsushi; Sakaki, Yoshiyuki; Takeda, Shunichi; Uchiyama, Yasuo; Hattori, Nobutaka; Takahashi, Ryosuke",FEBS LETTERS,MAY 2 2013,2013,,,53.0,4.82,4.0,5.2
23390232,2011,2013,14800000,0,14301,3,BIO,1,10.1093/brain/awt029,Loss of TDP-43 causes age-dependent progressive motor neuron degeneration,"Iguchi, Yohei; Katsuno, Masahisa; Niwa, Jun-ichi; Takagi, Shinnosuke; Ishigaki, Shinsuke; Ikenaka, Kensuke; Kawai, Kaori; Watanabe, Hirohisa; Yamanaka, Koji; Takahashi, Ryosuke; Misawa, Hidemi; Sasaki, Shoichi; Tanaka, Fumiaki; Sobue, Gen",BRAIN,MAY 2013,2013,,,118.0,10.73,9.0,10.6
23390232,2011,2013,14800000,0,14301,3,BIO,1,10.1126/scitranslmed.3005697,Response to Comment on Drug Screening for ALS Using Patient-Specific Induced Pluripotent Stem Cells,"Egawa, Naohiro; Kitaoka, Shiho; Tsukita, Kayoko; Naitoh, Motoko; Takahashi, Kazutoshi; Yamamoto, Takuya; Adachi, Fumihiko; Kondo, Takayuki; Okita, Keisuke; Asaka, Isao; Aoi, Takashi; Watanabe, Akira; Yamada, Yasuhiro; Morizane, Asuka; Takahashi, Jun; Ayaki, Takashi; Ito, Hidefumi; Yoshikawa, Katsuhiro; Yamawaki, Satoko; Suzuki, Shigehiko; Watanabe, Dai; Hioki, Hiroyuki; Kaneko, Takeshi; Makioka, Kouki; Okamoto, Koichi; Takuma, Hiroshi; Tamaoka, Akira; Hasegawa, Kazuko; Nonaka, Takashi; Hasegawa, Masato; Kawata, Akihiro; Yoshida, Minoru; Nakahata, Tatsutoshi; Takahashi, Ryosuke; Marchetto, Maria C. N.; Gage, Fred H.; Yamanaka, Shinya; Inoue, Haruhisa",SCIENCE TRANSLATIONAL MEDICINE,JUN 5 2013,2013,,,4.0,0.36,1.0,0.8
23390232,2011,2013,14800000,0,14301,3,BIO,1,10.1093/hmg/ddt095,PINK1 and Parkin complementarily protect dopaminergic neurons in vertebrates,"Matsui, Hideaki; Gavinio, Roberto; Asano, Takeshi; Uemura, Norihito; Ito, Hidefumi; Taniguchi, Yoshihito; Kobayashi, Yoshito; Maki, Takakuni; Shen, Jie; Takeda, Shunichi; Uemura, Kengo; Yamakado, Hodaka; Takahashi, Ryosuke",HUMAN MOLECULAR GENETICS,JUN 15 2013,2013,,,36.0,3.27,3.666666667,3.6
23390232,2011,2013,14800000,0,14301,3,BIO,1,10.1016/j.neulet.2013.04.057,Copper enhances APP dimerization and promotes A beta production,"Noda, Yasuha; Asada, Megumi; Kubota, Masakazu; Maesako, Masato; Watanabe, Kiwamu; Uemura, Maiko; Kihara, Takeshi; Shimohama, Shun; Takahashi, Ryosuke; Kinoshita, Ayae; Uemura, Kengo",NEUROSCIENCE LETTERS,JUN 28 2013,2013,,,41.0,3.73,5.0,4.4
23390232,2011,2013,14800000,0,14301,3,BIO,1,10.1186/1756-6606-6-35,"Chronic overload of SEPT4, a parkin substrate that aggregates in Parkinson's disease, causes behavioral alterations but not neurodegeneration in mice","Ageta-Ishihara, Natsumi; Yamakado, Hodaka; Morita, Takao; Hattori, Satoko; Takao, Keizo; Miyakawa, Tsuyoshi; Takahashi, Ryosuke; Kinoshita, Makoto",MOLECULAR BRAIN,AUG 11 2013,2013,,,20.0,1.82,1.0,1.8
23390232,2011,2013,14800000,0,14301,3,BIO,1,10.1111/jnc.12326,Optineurin suppression causes neuronal cell death via NF-kappa B pathway,"Akizuki, Mayumi; Yamashita, Hirofumi; Uemura, Kengo; Maruyama, Hirofumi; Kawakami, Hideshi; Ito, Hidefumi; Takahashi, Ryosuke",JOURNAL OF NEUROCHEMISTRY,SEP 2013,2013,,,67.0,6.09,4.333333333,5.8
23390232,2011,2013,14800000,0,14301,3,BIO,1,10.1016/j.neurobiolaging.2013.07.014,Nardilysin prevents amyloid plaque formation by enhancing alpha-secretase activity in an Alzheimer's disease mouse model,"Ohno, Mikiko; Hiraoka, Yoshinori; Lichtenthaler, Stefan F.; Nishi, Kiyoto; Saijo, Sayaka; Matsuoka, Tatsuhiko; Tomimoto, Hidekazu; Araki, Wataru; Takahashi, Ryosuke; Kita, Toru; Kimura, Takeshi; Nishi, Eiichiro",NEUROBIOLOGY OF AGING,JAN 2014,2014,,,24.0,2.4,3.666666667,3.2
23390232,2011,2013,14800000,0,14301,3,BIO,1,10.1016/j.neurobiolaging.2013.07.014,Nardilysin prevents amyloid plaque formation by enhancing alpha-secretase activity in an Alzheimer's disease mouse model,"Ohno, Mikiko; Hiraoka, Yoshinori; Lichtenthaler, Stefan F.; Nishi, Kiyoto; Saijo, Sayaka; Matsuoka, Tatsuhiko; Tomimoto, Hidekazu; Araki, Wataru; Takahashi, Ryosuke; Kita, Toru; Kimura, Takeshi; Nishi, Eiichiro",NEUROBIOLOGY OF AGING,JAN 2014,2014,,,24.0,2.4,3.666666667,3.2
23300117,2011,2013,15400000,0,14301,3,INT,1,10.1016/j.neurobiolaging.2013.07.014,Nardilysin prevents amyloid plaque formation by enhancing alpha-secretase activity in an Alzheimer's disease mouse model,"Ohno, Mikiko; Hiraoka, Yoshinori; Lichtenthaler, Stefan F.; Nishi, Kiyoto; Saijo, Sayaka; Matsuoka, Tatsuhiko; Tomimoto, Hidekazu; Araki, Wataru; Takahashi, Ryosuke; Kita, Toru; Kimura, Takeshi; Nishi, Eiichiro",NEUROBIOLOGY OF AGING,JAN 2014,2014,,,24.0,2.4,3.666666667,3.2
23300117,2011,2013,15400000,0,14301,3,INT,1,10.1016/j.neurobiolaging.2013.07.014,Nardilysin prevents amyloid plaque formation by enhancing alpha-secretase activity in an Alzheimer's disease mouse model,"Ohno, Mikiko; Hiraoka, Yoshinori; Lichtenthaler, Stefan F.; Nishi, Kiyoto; Saijo, Sayaka; Matsuoka, Tatsuhiko; Tomimoto, Hidekazu; Araki, Wataru; Takahashi, Ryosuke; Kita, Toru; Kimura, Takeshi; Nishi, Eiichiro",NEUROBIOLOGY OF AGING,JAN 2014,2014,,,24.0,2.4,3.666666667,3.2
23390232,2011,2013,14800000,0,14301,3,BIO,1,10.1371/journal.pone.0072796,Continuation of Exercise Is Necessary to Inhibit High Fat Diet-Induced beta-Amyloid Deposition and Memory Deficit in Amyloid Precursor Protein Transgenic Mice,"Maesako, Masato; Uemura, Kengo; Iwata, Ayana; Kubota, Masakazu; Watanabe, Kiwamu; Uemura, Maiko; Noda, Yasuha; Asada-Utsugi, Megumi; Kihara, Takeshi; Takahashi, Ryosuke; Shimohama, Shun; Kinoshita, Ayae",PLOS ONE,SEP 4 2013,2013,,,30.0,2.73,3.333333333,3.4
23390232,2011,2013,14800000,0,14301,3,BIO,1,10.1002/mds.25711,The Function of Parkin: Revisited,"Yamakado, Hodaka; Takahashi, Ryosuke",MOVEMENT DISORDERS,DEC 2013,2013,,,0.0,0.0,0.0,0.0
23390232,2011,2013,14800000,0,14301,3,BIO,1,10.1002/mds.25710,Genetic Correction Will Be a Standard Method for the Patient-Derived iPS Cell Research?,"Takahashi, Ryosuke; Yamakado, Hodaka",MOVEMENT DISORDERS,DEC 2013,2013,,,0.0,0.0,0.0,0.0
23390232,2011,2013,14800000,0,14301,3,BIO,1,10.1016/j.neures.2013.09.006,"Chicken DT40 cell line lacking DJ-1, the gene responsible for familial Parkinson's disease, displays mitochondrial dysfunction","Minakawa, Eiko N.; Yamakado, Hodaka; Tanaka, Atsushi; Uemura, Kengo; Takeda, Shunichi; Takahashi, Ryosuke",NEUROSCIENCE RESEARCH,DEC 2013,2013,,,5.0,0.45,0.0,0.4
23390232,2011,2013,14800000,0,14301,3,BIO,1,10.1101/gad.203406.112,Tricornered/NDR kinase signaling mediates PINK1-directed mitochondrial quality control and tissue maintenance,"Wu, Zhihao; Sawada, Tomoyo; Shiba, Kahori; Liu, Song; Kanao, Tomoko; Takahashi, Ryosuke; Hattori, Nobutaka; Imai, Yuzuru; Lu, Bingwei",GENES & DEVELOPMENT,JAN 15 2013,2013,,,36.0,3.27,4.333333333,4.0
23390232,2011,2013,14800000,0,14301,3,BIO,1,10.1111/dgd.12104,"Design, evaluation, and screening methods for efficient targeted mutagenesis with transcription activator-like effector nucleases in medaka","Ansai, Satoshi; Inohaya, Keiji; Yoshiura, Yasutoshi; Schartl, Manfred; Uemura, Norihito; Takahashi, Ryosuke; Kinoshita, Masato",DEVELOPMENT GROWTH & DIFFERENTIATION,JAN 2014,2014,,,58.0,5.8,7.333333333,7.4
23390232,2011,2013,14800000,0,14301,3,BIO,1,10.1016/j.neures.2013.12.002,Involvement of Wnt/beta-catenin signaling in the development of neuropathic pain,"Itokazu, Takahide; Hayano, Yasufumi; Takahashi, Ryosuke; Yamashita, Toshihide",NEUROSCIENCE RESEARCH,FEB 2014,2014,,,47.0,4.7,3.666666667,3.4
23390232,2011,2013,14800000,0,14301,3,BIO,1,10.1111/jnc.12441,Transglutaminase 2 accelerates neuroinflammation in amyotrophic lateral sclerosis through interaction with misfolded superoxide dismutase 1,"Oono, Miki; Okado-Matsumoto, Ayako; Shodai, Akemi; Ido, Akemi; Ohta, Yasuyuki; Abe, Koji; Ayaki, Takashi; Ito, Hidefumi; Takahashi, Ryosuke; Taniguchi, Naoyuki; Urushitani, Makoto",JOURNAL OF NEUROCHEMISTRY,FEB 2014,2014,,,21.0,2.1,2.333333333,1.8
23390232,2011,2013,14800000,0,14301,3,BIO,1,10.1111/j.1471-4159.2012.07741.x,Gain of function by phosphorylation in Presenilin 1-mediated regulation of insulin signaling,"Maesako, Masato; Uemura, Kengo; Kuzuya, Akira; Sasaki, Kazuki; Asada, Megumi; Watanabe, Kiwamu; Ando, Koichi; Kubota, Masakazu; Akiyama, Haruhiko; Takahashi, Ryosuke; Kihara, Takeshi; Shimohama, Shun; Kinoshita, Ayae",JOURNAL OF NEUROCHEMISTRY,JUN 2012,2012,,,6.0,0.5,0.0,0.6
23390232,2011,2013,14800000,0,14301,3,BIO,1,10.1093/hmg/dds184,A rat model for LGI1-related epilepsies,"Baulac, Stephanie; Ishida, Saeko; Mashimo, Tomoji; Boillot, Morgane; Fumoto, Naohiro; Kuwamura, Mitsuru; Ohno, Yukihiro; Takizawa, Akiko; Aoto, Toshihiro; Ueda, Masatsugu; Ikeda, Akio; LeGuern, Eric; Takahashi, Ryosuke; Serikawa, Tadao",HUMAN MOLECULAR GENETICS,AUG 15 2012,2012,,,27.0,2.25,2.333333333,2.8
23390232,2011,2013,14800000,0,14301,3,BIO,1,10.1016/j.neures.2012.03.010,alpha-Synuclein BAC transgenic mice as a model for Parkinson's disease manifested decreased anxiety-like behavior and hyperlocomotion,"Yamakado, Hodaka; Moriwaki, Yasuhiro; Yamasaki, Nobuyuki; Miyakawa, Tsuyoshi; Kurisu, Junko; Uemura, Kengo; Inoue, Haruhisa; Takahashi, Makio; Takahashi, Ryosuke",NEUROSCIENCE RESEARCH,JUN 2012,2012,,,35.0,2.92,2.666666667,2.2
23390232,2011,2013,14800000,0,14301,3,BIO,1,10.1073/pnas.1209979109,Donor-dependent variations in hepatic differentiation from human-induced pluripotent stem cells,"Kajiwara, Masatoshi; Aoi, Takashi; Okita, Keisuke; Takahashi, Ryosuke; Inoue, Haruhisa; Takayama, Naoya; Endo, Hiroshi; Eto, Koji; Toguchida, Junya; Uemoto, Shinji; Yamanaka, Shinya",PROCEEDINGS OF THE NATIONAL ACADEMY OF SCIENCES OF THE UNITED STATES OF AMERICA,JUL 31 2012,2012,,,217.0,18.08,11.66666667,15.2
23390232,2011,2013,14800000,0,14301,3,BIO,1,10.1126/scitranslmed.3004052,Drug Screening for ALS Using Patient-Specific Induced Pluripotent Stem Cells,"Egawa, Naohiro; Kitaoka, Shiho; Tsukita, Kayoko; Naitoh, Motoko; Takahashi, Kazutoshi; Yamamoto, Takuya; Adachi, Fumihiko; Kondo, Takayuki; Okita, Keisuke; Asaka, Isao; Aoi, Takashi; Watanabe, Akira; Yamada, Yasuhiro; Morizane, Asuka; Takahashi, Jun; Ayaki, Takashi; Ito, Hidefumi; Yoshikawa, Katsuhiro; Yamawaki, Satoko; Suzuki, Shigehiko; Watanabe, Dai; Hioki, Hiroyuki; Kaneko, Takeshi; Makioka, Kouki; Okamoto, Koichi; Takuma, Hiroshi; Tamaoka, Akira; Hasegawa, Kazuko; Nonaka, Takashi; Hasegawa, Masato; Kawata, Akihiro; Yoshida, Minoru; Nakahata, Tatsutoshi; Takahashi, Ryosuke; Marchetto, Maria C. N.; Gage, Fred H.; Yamanaka, Shinya; Inoue, Haruhisa",SCIENCE TRANSLATIONAL MEDICINE,AUG 1 2012,2012,,,382.0,31.83,31.33333333,40.2
23390232,2011,2013,14800000,0,14301,3,BIO,1,10.1371/journal.pgen.1002537,Parkinson's Disease-Associated Kinase PINK1 Regulates Miro Protein Level and Axonal Transport of Mitochondria,"Liu, Song; Sawada, Tomoyo; Lee, Seongsoo; Yu, Wendou; Silverio, George; Alapatt, Philomena; Millan, Ivan; Shen, Alice; Saxton, William; Kanao, Tomoko; Takahashi, Ryosuke; Hattori, Nobutaka; Imai, Yuzuru; Lu, Bingwei",PLOS GENETICS,MAR 2012,2012,,,261.0,21.75,24.66666667,24.8
23370034,2011,2014,8200000,0,17201,4,BIO,1,10.1016/j.jip.2013.10.013,Immunoevasive protein (IEP)-containing surface layer covering polydnavirus particles is essential for viral infection,"Furihata, Shunsuke; Tanaka, Kohjiro; Ryuda, Masasuke; Ochiai, Masanori; Matsumoto, Hitoshi; Csikos, Gyorge; Hayakawa, Yoichi",JOURNAL OF INVERTEBRATE PATHOLOGY,JAN 2014,2014,,,8.0,0.8,1.0,0.8
23370034,2011,2014,8200000,0,17201,4,BIO,1,10.1016/j.jinsphys.2013.11.008,Gain of long tonic immobility behavioral trait causes the red flour beetle to reduce anti-stress capacity,"Kiyotake, Hikaru; Matsumoto, Hitoshi; Nakayama, Satoshi; Sakai, Miyuki; Miyatake, Takahisa; Ryuda, Masasuke; Hayakawa, Yoichi",JOURNAL OF INSECT PHYSIOLOGY,JAN 2014,2014,,,24.0,2.4,1.333333333,2.0
23370034,2011,2014,8200000,0,17201,4,BIO,1,10.1007/s13355-014-0261-3,Changes of RNA virus infection rates and gut microbiota in young worker Apis mellifera (Hymenoptera: Apidae) of a chalkbrood-infected colony after a pollination task in a greenhouse,"Matsumoto, Hitoshi; Nomura, Sachiyo; Hayakawa, Yoichi",APPLIED ENTOMOLOGY AND ZOOLOGY,AUG 2014,2014,,,2.0,0.2,0.333333333,0.2
23370034,2011,2014,8200000,0,17201,4,BIO,1,10.1038/ncomms5628,Switching between humoral and cellular immune responses in Drosophila is guided by the cytokine GBP,"Tsuzuki, Seiji; Matsumoto, Hitoshi; Furihata, Shunsuke; Ryuda, Masasuke; Tanaka, Hirotoshi; Sung, Eui Jae; Bird, Gary S.; Zhou, Yixing; Shears, Stephen B.; Hayakawa, Yoichi",NATURE COMMUNICATIONS,AUG 2014,2014,,,55.0,5.5,4.666666667,5.0
23370034,2011,2014,8200000,0,17201,4,BIO,1,10.1038/srep00210,Drosophila growth-blocking peptide-like factor mediates acute immune reactions during infectious and non-infectious stress,"Tsuzuki, Seiji; Ochiai, Masanori; Matsumoto, Hitoshi; Kurata, Shoichiro; Ohnishi, Atsushi; Hayakawa, Yoichi",SCIENTIFIC REPORTS,JAN 5 2012,2012,,,47.0,3.92,4.0,5.0
23370034,2011,2014,8200000,0,17201,4,BIO,1,10.1016/j.ibmb.2011.11.009,Enhanced expression of stress-responsive cytokine-like gene retards insect larval growth,"Yamaguchi, Koichiro; Matsumoto, Hitoshi; Ochiai, Masanori; Tsuzuki, Seiji; Hayakawa, Yoichi",INSECT BIOCHEMISTRY AND MOLECULAR BIOLOGY,MAR 2012,2012,,,25.0,2.08,2.333333333,1.8
23370034,2011,2014,8200000,0,17201,4,BIO,1,10.1016/j.ibmb.2012.03.001,Characteristics common to a cytokine family spanning five orders of insects,"Matsumoto, Hitoshi; Tsuzuki, Seiji; Date-Ito, Atsuko; Ohnishi, Atsushi; Hayakawa, Yoichi",INSECT BIOCHEMISTRY AND MOLECULAR BIOLOGY,JUN 2012,2012,,,32.0,2.67,2.333333333,3.0
22390076,2010,2012,13700000,0,14202,3,BIO,1,10.1371/journal.pone.0037220,Memory Immune Responses against Pandemic (H1N1) 2009 Influenza Virus Induced by a Whole Particle Vaccine in Cynomolgus Monkeys Carrying Mafa-A1*052:02,"Arikata, Masahiko; Itoh, Yasushi; Okamatsu, Masatoshi; Maeda, Toshinaga; Shiina, Takashi; Tanaka, Keiko; Suzuki, Shingo; Nakayama, Misako; Sakoda, Yoshihiro; Ishigaki, Hirohito; Takada, Ayato; Ishida, Hideaki; Soda, Kosuke; Van Loi Pham; Tsuchiya, Hideaki; Nakamura, Shinichiro; Torii, Ryuzo; Shimizu, Takeshi; Inoko, Hidetoshi; Ohkubo, Iwao; Kida, Hiroshi; Ogasawara, Kazumasa",PLOS ONE,MAY 18 2012,2012,,,19.0,1.58,1.333333333,1.6
22390076,2010,2012,13700000,0,14202,3,BIO,1,10.1016/j.virol.2010.08.006,Establishment of a cynomolgus macaque model of influenza B virus infection,"Kitano, Mitsutaka; Itoh, Yasushi; Kodama, Makoto; Ishigaki, Hirohito; Nakayama, Misako; Nagata, Tomoya; Ishida, Hideaki; Tsuchiya, Hideaki; Toni, Ryuzo; Baba, Keiko; Yoshida, Ryu; Sato, Akihiko; Ogasawara, Kazumasa",VIROLOGY,NOV 25 2010,2010,,,18.0,1.29,1.333333333,1.2
22390061,2010,2012,13900000,0,16101,3,BIO,1,10.2337/db11-1767,"Brown Rice and Its Component, gamma-Oryzanol, Attenuate the Preference for High-Fat Diet by Decreasing Hypothalamic Endoplasmic Reticulum Stress in Mice","Kozuka, Chisayo; Yabiku, Kouichi; Sunagawa, Sumito; Ueda, Rei; Taira, Shin-ichiro; Ohshiro, Hiroyuki; Ikema, Tomomi; Yamakawa, Ken; Higa, Moritake; Tanaka, Hideaki; Takayama, Chitoshi; Matsushita, Masayuki; Oyadomari, Seiichi; Shimabukuro, Michio; Masuzaki, Hiroaki",DIABETES,DEC 2012,2012,,,59.0,4.92,2.333333333,4.2
22390061,2010,2012,13900000,0,16101,3,BIO,1,10.1016/j.yexcr.2012.04.016,Nanosecond pulsed electric fields act as a novel cellular stress that induces translational suppression accompanied by eIF2 alpha phosphorylation and 4E-BP1 dephosphorylation,"Morotomi-Yano, Keiko; Oyadomari, Seiichi; Akiyama, Hidenori; Yano, Ken-ichi",EXPERIMENTAL CELL RESEARCH,AUG 15 2012,2012,,,31.0,2.58,2.666666667,2.6
22390061,2010,2012,13900000,0,16101,3,BIO,1,10.1007/s10495-011-0576-2,CHOP deletion does not impact the development of diabetes but suppresses the early production of insulin autoantibody in the NOD mouse,"Satoh, T.; Abiru, N.; Kobayashi, M.; Zhou, H.; Nakamura, K.; Kuriya, G.; Nakamura, H.; Nagayama, Y.; Kawasaki, E.; Yamasaki, H.; Yu, L.; Eisenbarth, G. S.; Araki, E.; Mori, M.; Oyadomari, S.; Eguchi, K.",APOPTOSIS,APR 2011,2011,,,15.0,1.15,1.666666667,1.4
23380084,2011,2013,14400000,0,14301,3,BIO,1,10.1016/j.enggeo.2014.03.006,"Pore-pressure generation and fluidization in a loess landslide triggered by the 1920 Haiyuan earthquake, China: A case study","Wang, Gonghui; Zhang, Dexuan; Furuya, Gen; Yang, Jun",ENGINEERING GEOLOGY,MAY 23 2014,2014,,,90.0,9.0,2.0,6.4
23380084,2011,2013,14400000,0,14301,3,BIO,1,10.1144/qjegh2013-085,Effect of pore-water chemistry on undrained shear behaviour of saturated loess,"Zhang, Fanyu; Wang, Gonghui; Kamai, Toshitaka; Chen, Wenwu",QUARTERLY JOURNAL OF ENGINEERING GEOLOGY AND HYDROGEOLOGY,AUG 2014,2014,,,35.0,3.5,0.333333333,2.0
23380084,2011,2013,14400000,0,14301,3,BIO,1,10.1016/j.enggeo.2013.12.017,"Mechanism of the slow-moving landslides in Jurassic red-strata in the Three Gorges Reservoir, China","Miao, Haibo; Wang, Gonghui; Yin, Kunlong; Kamai, Toshitaka; Li, Yuanyao",ENGINEERING GEOLOGY,MAR 13 2014,2014,,,107.0,10.7,7.333333333,9.4
23380084,2011,2013,14400000,0,14301,3,BIO,1,10.1016/j.geomorph.2013.11.009,"Some fluidized landslides triggered by the 2011 Tohoku Earthquake (Mw 9.0), Japan","Wang, Gonghui; Suemine, Akira; Zhang, Fanyu; Hata, Yoshiya; Fukuoka, Hiroshi; Kamai, Toshitaka",GEOMORPHOLOGY,MAR 1 2014,2014,,,20.0,2.0,1.0,1.4
23380084,2011,2013,14400000,0,14301,3,BIO,1,10.1002/esp.3277,"Landslide Amplification by Liquefaction of Runout-Path Material after the 2008 Wenchuan (M 8.0) Earthquake, China","Wang, Gonghui; Huang, Runqiu; Chigira, Masahiro; Wu, Xiyong; Lourenco, Sergio D. N.",EARTH SURFACE PROCESSES AND LANDFORMS,MAR 2013,2013,,,35.0,3.18,2.0,3.0
23380084,2011,2013,14400000,0,14301,3,BIO,1,10.1002/esp.3277,"Landslide Amplification by Liquefaction of Runout-Path Material after the 2008 Wenchuan (M 8.0) Earthquake, China","Wang, Gonghui; Huang, Runqiu; Chigira, Masahiro; Wu, Xiyong; Lourenco, Sergio D. N.",EARTH SURFACE PROCESSES AND LANDFORMS,MAR 2013,2013,,,35.0,3.18,2.0,3.0
23310126,2011,2013,5600000,0,14301,3,INT,1,10.1002/esp.3277,"Landslide Amplification by Liquefaction of Runout-Path Material after the 2008 Wenchuan (M 8.0) Earthquake, China","Wang, Gonghui; Huang, Runqiu; Chigira, Masahiro; Wu, Xiyong; Lourenco, Sergio D. N.",EARTH SURFACE PROCESSES AND LANDFORMS,MAR 2013,2013,,,35.0,3.18,2.0,3.0
23310126,2011,2013,5600000,0,14301,3,INT,1,10.1002/esp.3277,"Landslide Amplification by Liquefaction of Runout-Path Material after the 2008 Wenchuan (M 8.0) Earthquake, China","Wang, Gonghui; Huang, Runqiu; Chigira, Masahiro; Wu, Xiyong; Lourenco, Sergio D. N.",EARTH SURFACE PROCESSES AND LANDFORMS,MAR 2013,2013,,,35.0,3.18,2.0,3.0
23380084,2011,2013,14400000,0,14301,3,BIO,1,10.1016/j.enggeo.2012.12.018,Undrained shear behavior of loess saturated with different concentrations of sodium chloride solution,"Zhang, Fanyu; Wang, Gonghui; Kamai, Toshitaka; Chen, Wenwu; Zhang, Dexuan; Yang, Jun",ENGINEERING GEOLOGY,MAR 14 2013,2013,,,147.0,13.36,2.666666667,6.2
23380084,2011,2013,14400000,0,14301,3,BIO,1,10.1007/s10346-012-0378-9,"Satellite remote sensing-based detection of the deformation of a reservoir bank slope in Laxiwa Hydropower Station, China","Zhang, Dexuan; Wang, Gonghui; Yang, Tinjun; Zhang, Mingchu; Chen, Shihang; Zhang, Fanyu",LANDSLIDES,APR 2013,2013,,,17.0,1.55,0.666666667,1.4
23380084,2011,2013,14400000,0,14301,3,BIO,1,10.1007/s12665-011-1106-9,Effectiveness of a new organic polymer sand-fixing agent on sand fixation,"Liu, Jin; Shi, Bin; Lu, Yi; Jiang, Hongtao; Huang, He; Wang, Gonghui; Kamai, Toshitaka",ENVIRONMENTAL EARTH SCIENCES,FEB 2012,2012,,,38.0,3.17,0.333333333,1.4
23380084,2011,2013,14400000,0,14301,3,BIO,1,10.1016/j.enggeo.2013.01.004,"The internal structure of a rockslide dam induced by the 2008 Wenchuan (M(w)7.9) earthquake, China","Wang, Gonghui; Huang, Runqiu; Kamai, Toshitaka; Zhang, Fanyu",ENGINEERING GEOLOGY,APR 1 2013,2013,,,25.0,2.27,2.0,1.8
23380084,2011,2013,14400000,0,14301,3,BIO,1,10.1016/j.geomorph.2012.05.003,"Transient water and sediment storage of the decaying landslide dams induced by the 2008 Wenchuan earthquake, China","Fan, Xuanmei; van Westen, Cees J.; Korup, Oliver; Gorum, Tolga; Xu, Qiang; Dai, Fuchu; Huang, Runqiu; Wang, Gonghui",GEOMORPHOLOGY,OCT 15 2012,2012,,,68.0,5.67,3.0,5.0
23380111,2011,2013,10300000,0,16301,3,BIO,1,10.1111/j.1348-0421.2012.00514.x,Genotypic characteristics of a Mycobacterium sp isolated from yellowtail Seriola quinqueradiata and striped jack Pseudocaranx dentex in Japan,"Imajoh, Masayuki; Sugiura, Hidehiro; Hashida, Yumiko; Hatai, Kishio; Oshima, Syun-ichirou; Daibata, Masanori; Kawai, Kenji",MICROBIOLOGY AND IMMUNOLOGY,JAN 2013,2013,,,3.0,0.27,0.0,0.2
23390465,2011,2013,14500000,0,17102,3,BIO,1,10.3892/ijo.2011.917,Involvement of epithelial-mesenchymal transition in adenoid cystic carcinoma metastasis,"Ishii, Kotaro; Shimoda, Miyuki; Sugiura, Tsuyoshi; Seki, Katsuhiro; Takahashi, Miho; Abe, Masakazu; Matsuki, Ryosuke; Inoue, Yoshiko; Shirasuna, Kanemitsu",INTERNATIONAL JOURNAL OF ONCOLOGY,APR 2011,2011,,,19.0,1.46,1.666666667,1.8
23390465,2011,2013,14500000,0,17102,3,BIO,1,10.3892/ijo.2012.1671,CD82 inhibits canonical Wnt signalling by controlling the cellular distribution of beta-catenin in carcinoma cells,"Chigita, Satomi; Sugiura, Tsuyoshi; Abe, Masakazu; Kobayashi, Yosuke; Shimoda, Miyuki; Onoda, Megumi; Shirasuna, Kanemitsu",INTERNATIONAL JOURNAL OF ONCOLOGY,DEC 2012,2012,,,14.0,1.17,1.333333333,1.8
23390465,2011,2013,14500000,0,17102,3,BIO,1,10.3892/ijo.2012.1673,T-box transcription factor Brachyury expression is correlated with epithelial-mesenchymal transition and lymph node metastasis in oral squamous cell carcinoma,"Imajyo, Ikumi; Sugiura, Tsuyoshi; Kobayashi, Yosuke; Shimoda, Miyuki; Ishii, Kotaro; Akimoto, Naonari; Yoshihama, Naoya; Kobayashi, Ieyoshi; Mori, Yoshihide",INTERNATIONAL JOURNAL OF ONCOLOGY,DEC 2012,2012,,,39.0,3.25,2.666666667,5.0
23390465,2011,2013,14500000,0,17102,3,BIO,1,10.1186/1471-2407-12-377,The T-box transcription factor Brachyury regulates epithelial-mesenchymal transition in association with cancer stem-like cells in adenoid cystic carcinoma cells,"Shimoda, Miyuki; Sugiura, Tsuyoshi; Imajyo, Ikumi; Ishii, Kotaro; Chigita, Satomi; Seki, Katsuhiro; Kobayashi, Yousuke; Shirasuna, Kanemitsu",BMC CANCER,AUG 29 2012,2012,,,48.0,4.0,4.666666667,5.4
